### ISSUE TITLE
Websocket connection quick abort after 101 response sent

### ISSUE THREAD

**Issue by liudonghua123** [jwilder/nginx-proxy#1331]
Hi, I build a java app with some static fontend files. So I wrap all of them in a docker container. I also want to use this `nginx-proxy` for automatic reverse proxy. One of my backend has a websocket endpoint. I can test it ok direct to the backend websocket. But If the connection go through the `nginx-proxy`, the connection seems to abort quickly after the backend sent 101 response. 

The following is the content of tcpdump.

```
root@696a2a38de27:/etc/nginx# tcpdump -nn -s0 -vvv
tcpdump: listening on eth0, link-type EN10MB (Ethernet), capture size 262144 bytes
01:40:25.025576 IP (tos 0x0, ttl 254, id 5722, offset 0, flags [none], proto TCP (6), length 60)
    113.55.15.1.51536 > 172.17.0.12.80: Flags [S], cksum 0x16c5 (correct), seq 2236554463, win 65535, options [mss 1188,sackOK,TS val 3422670379 ecr 0,nop,wscale 0], length 0
01:40:25.025612 IP (tos 0x0, ttl 64, id 0, offset 0, flags [DF], proto TCP (6), length 60)
    172.17.0.12.80 > 113.55.15.1.51536: Flags [S.], cksum 0x2c84 (incorrect -> 0xb434), seq 560790910, ack 2236554464, win 28960, options [mss 1460,sackOK,TS val 3188003671 ecr 3422670379,nop,wscale 7], length 0
01:40:25.025849 IP (tos 0x0, ttl 254, id 5728, offset 0, flags [none], proto TCP (6), length 52)
    113.55.15.1.51536 > 172.17.0.12.80: Flags [.], cksum 0x5421 (correct), seq 1, ack 1, win 65535, options [nop,nop,TS val 3422670379 ecr 3188003671], length 0
01:40:25.025890 IP (tos 0x0, ttl 254, id 5729, offset 0, flags [none], proto TCP (6), length 309)
    113.55.15.1.51536 > 172.17.0.12.80: Flags [P.], cksum 0x14c9 (correct), seq 1:258, ack 1, win 65535, options [nop,nop,TS val 3422670379 ecr 3188003671], length 257: HTTP, length: 257
	GET /jeecg-boot/terminal HTTP/1.1
	Sec-WebSocket-Version: 13
	Sec-WebSocket-Key: D8QKHFCCmZl2Z1yhYSXdMA==
	Connection: Upgrade
	Upgrade: websocket
	Sec-WebSocket-Extensions: permessage-deflate; client_max_window_bits
	Host: dns-management.api.ynu.edu.cn
	
01:40:25.025901 IP (tos 0x0, ttl 64, id 1011, offset 0, flags [DF], proto TCP (6), length 52)
    172.17.0.12.80 > 113.55.15.1.51536: Flags [.], cksum 0x2c7c (incorrect -> 0x5235), seq 1, ack 258, win 235, options [nop,nop,TS val 3188003671 ecr 3422670379], length 0
01:40:25.032425 IP (tos 0x0, ttl 64, id 1012, offset 0, flags [DF], proto TCP (6), length 293)
    172.17.0.12.80 > 113.55.15.1.51536: Flags [P.], cksum 0x2d6d (incorrect -> 0x1d5f), seq 1:242, ack 258, win 235, options [nop,nop,TS val 3188003678 ecr 3422670379], length 241: HTTP, length: 241
	HTTP/1.1 101 
	Server: nginx/1.14.1
	Date: Wed, 18 Sep 2019 01:40:25 GMT
	Connection: upgrade
	Upgrade: websocket
	Sec-WebSocket-Accept: GwCMy435wRVuFQhUBQ9340Twg4U=
	Sec-WebSocket-Extensions: permessage-deflate;client_max_window_bits=15
	
01:40:25.040166 IP (tos 0x0, ttl 254, id 5744, offset 0, flags [none], proto TCP (6), length 52)
    113.55.15.1.51536 > 172.17.0.12.80: Flags [F.], cksum 0x5219 (correct), seq 258, ack 242, win 65535, options [nop,nop,TS val 3422670393 ecr 3188003678], length 0
01:40:25.040344 IP (tos 0x0, ttl 64, id 1013, offset 0, flags [DF], proto TCP (6), length 52)
    172.17.0.12.80 > 113.55.15.1.51536: Flags [F.], cksum 0x2c7c (incorrect -> 0x5125), seq 242, ack 259, win 235, options [nop,nop,TS val 3188003686 ecr 3422670393], length 0
01:40:25.040583 IP (tos 0x0, ttl 254, id 5747, offset 0, flags [none], proto TCP (6), length 52)
    113.55.15.1.51536 > 172.17.0.12.80: Flags [.], cksum 0x520f (correct), seq 259, ack 243, win 65535, options [nop,nop,TS val 3422670394 ecr 3188003686], length 0
^C
9 packets captured
9 packets received by filter
0 packets dropped by kernel
root@696a2a38de27:/etc/nginx#
```

The following content is ok when I test it direct to my backend without `nginx-proxy`.

```
root@6001db6e3f32:/# tcpdump -nn -s0 -vvv
tcpdump: listening on eth0, link-type EN10MB (Ethernet), capture size 262144 bytes


01:58:18.580313 IP (tos 0x0, ttl 64, id 59235, offset 0, flags [DF], proto TCP (6), length 60)
    192.168.48.1.35786 > 192.168.48.5.80: Flags [S], cksum 0xe185 (incorrect -> 0x4295), seq 2044850579, win 29200, options [mss 1460,sackOK,TS val 110212066 ecr 0,nop,wscale 7], length 0
01:58:18.580356 IP (tos 0x0, ttl 64, id 0, offset 0, flags [DF], proto TCP (6), length 60)
    192.168.48.5.80 > 192.168.48.1.35786: Flags [S.], cksum 0xe185 (incorrect -> 0x020e), seq 2335434414, ack 2044850580, win 28960, options [mss 1460,sackOK,TS val 2519284058 ecr 110212066,nop,wscale 7], length 0
01:58:18.580377 IP (tos 0x0, ttl 64, id 59236, offset 0, flags [DF], proto TCP (6), length 52)
    192.168.48.1.35786 > 192.168.48.5.80: Flags [.], cksum 0xe17d (incorrect -> 0xa115), seq 1, ack 1, win 229, options [nop,nop,TS val 110212066 ecr 2519284058], length 0
01:58:18.580936 IP (tos 0x0, ttl 64, id 59237, offset 0, flags [DF], proto TCP (6), length 295)
    192.168.48.1.35786 > 192.168.48.5.80: Flags [P.], cksum 0xe270 (incorrect -> 0xd5bc), seq 1:244, ack 1, win 229, options [nop,nop,TS val 110212066 ecr 2519284058], length 243: HTTP, length: 243
	GET /jeecg-boot/terminal HTTP/1.1
	Sec-WebSocket-Version: 13
	Sec-WebSocket-Key: QanxCPyI3fPxoYYstRhvyw==
	Connection: Upgrade
	Upgrade: websocket
	Sec-WebSocket-Extensions: permessage-deflate; client_max_window_bits
	Host: localhost:33177
	
01:58:18.580965 IP (tos 0x0, ttl 64, id 61535, offset 0, flags [DF], proto TCP (6), length 52)
    192.168.48.5.80 > 192.168.48.1.35786: Flags [.], cksum 0xe17d (incorrect -> 0xa01c), seq 1, ack 244, win 235, options [nop,nop,TS val 2519284058 ecr 110212066], length 0
01:58:18.581327 IP (tos 0x0, ttl 64, id 34085, offset 0, flags [DF], proto TCP (6), length 60)
    192.168.48.5.44488 > 192.168.48.4.8080: Flags [S], cksum 0xe188 (incorrect -> 0x1a04), seq 1247843284, win 29200, options [mss 1460,sackOK,TS val 2699529756 ecr 0,nop,wscale 7], length 0
01:58:18.581376 IP (tos 0x0, ttl 64, id 0, offset 0, flags [DF], proto TCP (6), length 60)
    192.168.48.4.8080 > 192.168.48.5.44488: Flags [S.], cksum 0xe188 (incorrect -> 0x97c6), seq 3159966214, ack 1247843285, win 28960, options [mss 1460,sackOK,TS val 2114389685 ecr 2699529756,nop,wscale 7], length 0
01:58:18.581387 IP (tos 0x0, ttl 64, id 34086, offset 0, flags [DF], proto TCP (6), length 52)
    192.168.48.5.44488 > 192.168.48.4.8080: Flags [.], cksum 0xe180 (incorrect -> 0x36ce), seq 1, ack 1, win 229, options [nop,nop,TS val 2699529756 ecr 2114389685], length 0
01:58:18.581587 IP (tos 0x0, ttl 64, id 34087, offset 0, flags [DF], proto TCP (6), length 357)
    192.168.48.5.44488 > 192.168.48.4.8080: Flags [P.], cksum 0xe2b1 (incorrect -> 0xc6eb), seq 1:306, ack 1, win 229, options [nop,nop,TS val 2699529756 ecr 2114389685], length 305: HTTP, length: 305
	GET /jeecg-boot/terminal HTTP/1.1
	Upgrade: websocket
	Connection: upgrade
	X-Forwarded-Proto: http
	X-Real-IP: 192.168.48.1
	Host: dns-management-backend:8080
	Sec-WebSocket-Version: 13
	Sec-WebSocket-Key: QanxCPyI3fPxoYYstRhvyw==
	Sec-WebSocket-Extensions: permessage-deflate; client_max_window_bits
	
01:58:18.581613 IP (tos 0x0, ttl 64, id 21750, offset 0, flags [DF], proto TCP (6), length 52)
    192.168.48.4.8080 > 192.168.48.5.44488: Flags [.], cksum 0xe180 (incorrect -> 0x3597), seq 1, ack 306, win 235, options [nop,nop,TS val 2114389685 ecr 2699529756], length 0
01:58:18.587254 IP (tos 0x0, ttl 64, id 21751, offset 0, flags [DF], proto TCP (6), length 271)
    192.168.48.4.8080 > 192.168.48.5.44488: Flags [P.], cksum 0xe25b (incorrect -> 0xbcc7), seq 1:220, ack 306, win 235, options [nop,nop,TS val 2114389691 ecr 2699529756], length 219: HTTP, length: 219
	HTTP/1.1 101 
	Upgrade: websocket
	Connection: upgrade
	Sec-WebSocket-Accept: xCk2UpmOT76NuH3PgfsYqRNyG7M=
	Sec-WebSocket-Extensions: permessage-deflate;client_max_window_bits=15
	Date: Wed, 18 Sep 2019 01:58:18 GMT
	
01:58:18.587273 IP (tos 0x0, ttl 64, id 34088, offset 0, flags [DF], proto TCP (6), length 52)
    192.168.48.5.44488 > 192.168.48.4.8080: Flags [.], cksum 0xe180 (incorrect -> 0x34ae), seq 306, ack 220, win 237, options [nop,nop,TS val 2699529762 ecr 2114389691], length 0
01:58:18.587337 IP (tos 0x0, ttl 64, id 61536, offset 0, flags [DF], proto TCP (6), length 293)
    192.168.48.5.80 > 192.168.48.1.35786: Flags [P.], cksum 0xe26e (incorrect -> 0x45ae), seq 1:242, ack 244, win 235, options [nop,nop,TS val 2519284065 ecr 110212066], length 241: HTTP, length: 241
	HTTP/1.1 101 
	Server: nginx/1.17.3
	Date: Wed, 18 Sep 2019 01:58:18 GMT
	Connection: upgrade
	Upgrade: websocket
	Sec-WebSocket-Accept: xCk2UpmOT76NuH3PgfsYqRNyG7M=
	Sec-WebSocket-Extensions: permessage-deflate;client_max_window_bits=15
	
01:58:18.587350 IP (tos 0x0, ttl 64, id 59238, offset 0, flags [DF], proto TCP (6), length 52)
    192.168.48.1.35786 > 192.168.48.5.80: Flags [.], cksum 0xe17d (incorrect -> 0x9f1b), seq 244, ack 242, win 237, options [nop,nop,TS val 110212073 ecr 2519284065], length 0
01:58:18.594344 IP (tos 0x0, ttl 64, id 59239, offset 0, flags [DF], proto TCP (6), length 82)
    192.168.48.1.35786 > 192.168.48.5.80: Flags [P.], cksum 0xe19b (incorrect -> 0xde24), seq 244:274, ack 242, win 237, options [nop,nop,TS val 110212080 ecr 2519284065], length 30: HTTP
01:58:18.594398 IP (tos 0x0, ttl 64, id 34089, offset 0, flags [DF], proto TCP (6), length 82)
    192.168.48.5.44488 > 192.168.48.4.8080: Flags [P.], cksum 0xe19e (incorrect -> 0x73b7), seq 306:336, ack 220, win 237, options [nop,nop,TS val 2699529769 ecr 2114389691], length 30: HTTP
01:58:18.594625 IP (tos 0x0, ttl 64, id 59240, offset 0, flags [DF], proto TCP (6), length 83)
    192.168.48.1.35786 > 192.168.48.5.80: Flags [P.], cksum 0xe19c (incorrect -> 0xec22), seq 274:305, ack 242, win 237, options [nop,nop,TS val 110212080 ecr 2519284065], length 31: HTTP
01:58:18.594771 IP (tos 0x0, ttl 64, id 61537, offset 0, flags [DF], proto TCP (6), length 52)
    192.168.48.5.80 > 192.168.48.1.35786: Flags [.], cksum 0xe17d (incorrect -> 0x9ed2), seq 242, ack 305, win 235, options [nop,nop,TS val 2519284072 ecr 110212080], length 0
01:58:18.594787 IP (tos 0x0, ttl 64, id 34090, offset 0, flags [DF], proto TCP (6), length 83)
    192.168.48.5.44488 > 192.168.48.4.8080: Flags [P.], cksum 0xe19f (incorrect -> 0x81b5), seq 336:367, ack 220, win 237, options [nop,nop,TS val 2699529769 ecr 2114389691], length 31: HTTP
01:58:18.595923 IP (tos 0x0, ttl 64, id 21752, offset 0, flags [DF], proto TCP (6), length 52)
    192.168.48.4.8080 > 192.168.48.5.44488: Flags [.], cksum 0xe180 (incorrect -> 0x3464), seq 220, ack 367, win 235, options [nop,nop,TS val 2114389699 ecr 2699529769], length 0
01:58:19.188988 IP (tos 0x0, ttl 64, id 21753, offset 0, flags [DF], proto TCP (6), length 114)
    192.168.48.4.8080 > 192.168.48.5.44488: Flags [P.], cksum 0xe1be (incorrect -> 0x5fd6), seq 220:282, ack 367, win 235, options [nop,nop,TS val 2114390292 ecr 2699529769], length 62: HTTP
01:58:19.189218 IP (tos 0x0, ttl 64, id 61538, offset 0, flags [DF], proto TCP (6), length 114)
    192.168.48.5.80 > 192.168.48.1.35786: Flags [P.], cksum 0xe1bb (incorrect -> 0xca42), seq 242:304, ack 305, win 235, options [nop,nop,TS val 2519284667 ecr 110212080], length 62: HTTP
01:58:19.232590 IP (tos 0x0, ttl 64, id 34091, offset 0, flags [DF], proto TCP (6), length 52)
    192.168.48.5.44488 > 192.168.48.4.8080: Flags [.], cksum 0xe180 (incorrect -> 0x2f55), seq 367, ack 282, win 237, options [nop,nop,TS val 2699530407 ecr 2114390292], length 0
01:58:19.232587 IP (tos 0x0, ttl 64, id 59241, offset 0, flags [DF], proto TCP (6), length 52)
    192.168.48.1.35786 > 192.168.48.5.80: Flags [.], cksum 0xe17d (incorrect -> 0x99c1), seq 305, ack 304, win 237, options [nop,nop,TS val 110212718 ecr 2519284667], length 0
01:58:19.596429 IP (tos 0x0, ttl 64, id 59242, offset 0, flags [DF], proto TCP (6), length 104)
    192.168.48.1.35786 > 192.168.48.5.80: Flags [P.], cksum 0xe1b1 (incorrect -> 0x809c), seq 305:357, ack 304, win 237, options [nop,nop,TS val 110213082 ecr 2519284667], length 52: HTTP
01:58:19.596512 IP (tos 0x0, ttl 64, id 34092, offset 0, flags [DF], proto TCP (6), length 104)
    192.168.48.5.44488 > 192.168.48.4.8080: Flags [P.], cksum 0xe1b4 (incorrect -> 0x1630), seq 367:419, ack 282, win 237, options [nop,nop,TS val 2699530771 ecr 2114390292], length 52: HTTP
01:58:19.600747 IP (tos 0x0, ttl 64, id 21754, offset 0, flags [DF], proto TCP (6), length 67)
    192.168.48.4.8080 > 192.168.48.5.44488: Flags [P.], cksum 0xe18f (incorrect -> 0x8cb5), seq 282:297, ack 419, win 235, options [nop,nop,TS val 2114390704 ecr 2699530771], length 15: HTTP
01:58:19.600774 IP (tos 0x0, ttl 64, id 34093, offset 0, flags [DF], proto TCP (6), length 52)
    192.168.48.5.44488 > 192.168.48.4.8080: Flags [.], cksum 0xe180 (incorrect -> 0x2c06), seq 419, ack 297, win 237, options [nop,nop,TS val 2699530775 ecr 2114390704], length 0
01:58:19.600802 IP (tos 0x0, ttl 64, id 61539, offset 0, flags [DF], proto TCP (6), length 67)
    192.168.48.5.80 > 192.168.48.1.35786: Flags [P.], cksum 0xe18c (incorrect -> 0xf722), seq 304:319, ack 357, win 235, options [nop,nop,TS val 2519285078 ecr 110213082], length 15: HTTP
01:58:19.600823 IP (tos 0x0, ttl 64, id 59243, offset 0, flags [DF], proto TCP (6), length 52)
    192.168.48.1.35786 > 192.168.48.5.80: Flags [.], cksum 0xe17d (incorrect -> 0x9673), seq 357, ack 319, win 237, options [nop,nop,TS val 110213086 ecr 2519285078], length 0
01:58:19.602764 IP (tos 0x0, ttl 64, id 21755, offset 0, flags [DF], proto TCP (6), length 62)
    192.168.48.4.8080 > 192.168.48.5.44488: Flags [P.], cksum 0xe18a (incorrect -> 0xddcf), seq 297:307, ack 419, win 235, options [nop,nop,TS val 2114390706 ecr 2699530775], length 10: HTTP
01:58:19.602794 IP (tos 0x0, ttl 64, id 34094, offset 0, flags [DF], proto TCP (6), length 52)
    192.168.48.5.44488 > 192.168.48.4.8080: Flags [.], cksum 0xe180 (incorrect -> 0x2bf8), seq 419, ack 307, win 237, options [nop,nop,TS val 2699530777 ecr 2114390706], length 0
01:58:19.602840 IP (tos 0x0, ttl 64, id 61540, offset 0, flags [DF], proto TCP (6), length 62)
    192.168.48.5.80 > 192.168.48.1.35786: Flags [P.], cksum 0xe187 (incorrect -> 0x483d), seq 319:329, ack 357, win 235, options [nop,nop,TS val 2519285080 ecr 110213086], length 10: HTTP
01:58:19.602856 IP (tos 0x0, ttl 64, id 59244, offset 0, flags [DF], proto TCP (6), length 52)
    192.168.48.1.35786 > 192.168.48.5.80: Flags [.], cksum 0xe17d (incorrect -> 0x9665), seq 357, ack 329, win 237, options [nop,nop,TS val 110213088 ecr 2519285080], length 0
01:58:19.604216 IP (tos 0x0, ttl 64, id 21756, offset 0, flags [DF], proto TCP (6), length 61)
    192.168.48.4.8080 > 192.168.48.5.44488: Flags [P.], cksum 0xe189 (incorrect -> 0xd47f), seq 307:316, ack 419, win 235, options [nop,nop,TS val 2114390708 ecr 2699530777], length 9: HTTP
01:58:19.604232 IP (tos 0x0, ttl 64, id 34095, offset 0, flags [DF], proto TCP (6), length 52)
    192.168.48.5.44488 > 192.168.48.4.8080: Flags [.], cksum 0xe180 (incorrect -> 0x2beb), seq 419, ack 316, win 237, options [nop,nop,TS val 2699530779 ecr 2114390708], length 0
01:58:19.604265 IP (tos 0x0, ttl 64, id 61541, offset 0, flags [DF], proto TCP (6), length 61)
    192.168.48.5.80 > 192.168.48.1.35786: Flags [P.], cksum 0xe186 (incorrect -> 0x3eed), seq 329:338, ack 357, win 235, options [nop,nop,TS val 2519285082 ecr 110213088], length 9: HTTP
01:58:19.604279 IP (tos 0x0, ttl 64, id 59245, offset 0, flags [DF], proto TCP (6), length 52)
    192.168.48.1.35786 > 192.168.48.5.80: Flags [.], cksum 0xe17d (incorrect -> 0x9658), seq 357, ack 338, win 237, options [nop,nop,TS val 110213090 ecr 2519285082], length 0
^C
38 packets captured
38 packets received by filter
0 packets dropped by kernel
root@6001db6e3f32:/# 
```

The test code of websocket is some like the belows.
```js
// local test
const WebSocket = require('ws');

const ws = new WebSocket('ws://localhost:33177/jeecg-boot/terminal');

ws.on('open', function open() {
  let type = 'TERMINAL_INIT';
  ws.send(`${JSON.stringify({ type })}`);
  type = 'TERMINAL_READY';
  ws.send(`${JSON.stringify({ type })}`);
  type = 'TERMINAL_COMMAND';
  setTimeout(() => {
    ws.send(`${JSON.stringify({ type, command: 'ls\r\n' })}`);
  },1000);
});

ws.on('message', function incoming(data) {
  console.log(`message with ${JSON.stringify(data)}`);
});

ws.on('error', function(data) {
  console.log(`error with ${JSON.stringify(data)}`);
});

ws.on('close', function(data) {
  console.log(`close with ${JSON.stringify(data)}`);
});

```

There's no special configurations in my `nginx-proxy`.

**Comment by mesudip** [comment]
Can you try it with [mesudip/nginx-proxy](https://github.com/mesudip/nginx-proxy) It's inspired by this project and uses  almost same nginx configuration. 

  You will need to change environment variable  to "VIRTUAL_HOST=ws://your_domain" instead of just the hostname when using mesudip/nginx-proxy
